id,unit_id,trigger,voice_id,beloved_step,time,face_id,description,insert_word_type
2586,108201,2,2,1,2,1,"For lunch, Miyako will eat\nluxury pudding à la mode!",0
2587,108201,2,3,1,3,1,"Evening time is for Halloween games with ghosts! You join in too!",0
2589,108201,3,2,1,0,1,"Even ghosts need resty break times! Now quick, bring pudding!",0
2590,108201,3,3,1,0,1,"Miyako invites you to a special party time!",0
2591,108201,3,4,1,0,1,"This is the comfiestest... Like going to heaven!",0
2592,108201,3,5,1,0,1,"With this, Miyako could make... baked pudding!",0
2594,108201,3,7,1,0,1,"Can't have Halloween on empty stomachs!",0
2595,108201,3,8,1,0,1,"This is... a recipe for whole-pumpkin pudding?!\nLooks too tasty!",0
2599,108301,1,1,1,0,1,"There's all sorts of other outfits I'd like to try out.",0
2600,108301,1,2,1,0,1,"Chocolate and candy is all well and good, but there has to be something that suits me more...",0
2601,108301,1,3,1,0,1,"Mom might get mad at me if I eat too many sweets...",0
2602,108301,1,4,1,0,1,"I bet everyone would be surprised if I went to school wearing this.",0
2603,108301,1,5,1,0,1,"I wonder how proper ladies spend their Halloween.",0
2604,108301,1,101,4,0,1,"I should save some candy for him! A real adult wouldn't keep it all to herself.",0
2605,108301,1,102,8,0,1,"There has to be some kind of spell that can charm him.",0
2606,108301,2,1,1,0,1,"Trick or treat! And I'm expecting some very fine treats!",0
2607,108301,2,2,1,0,1,"I'll pick out a real nice costume for you. Trust my adult tastes!",0
2608,108301,2,3,1,0,1,"A-am I the only one that thinks jack-o'-lanterns are creepy?",0
2609,108301,2,4,1,0,1,"Halloween was so fun I forgot to do my homework! H-help me out, please!",0
2610,108301,2,101,4,0,1,"I'm fine with asking for treats if I'm with you!",0
2611,108301,2,102,8,0,1,"You're the only one I trust to take the lead, you know.",0
2612,108301,2,1,1,1,1,"There's nothing more classy than a green smoothie for breakfast! U-urgh, it's so bitter.",0
2613,108301,2,2,1,2,1,"Teatime at a cafe as the afternoon winds down... Now that's something I'd love to do.",0
2614,108301,2,3,1,3,1,"It's time to head into town and enjoy a lovely Halloween night!",0
2616,108301,3,2,1,0,1,"Urgh... I can't move after eating all that candy!",0
2617,108301,3,3,1,0,1,"How about you dress up as well? You'll be even cuter if you do!",0
2618,108301,3,4,1,0,1,"Now this is a real adult's scent. ♪",0
2619,108301,3,5,1,0,1,"It's so nice and warm. ♪ Wait, my chocolate's melting!",0
2621,108301,3,7,1,0,1,"It's so good! Errr, I mean. Wh-what a delightful taste!",0
2622,108301,3,8,1,0,1,"These clothes are so cute. ♪ Whoa, what's with that price?! I'd need to save up for years!",0
2626,107101,1,1,1,0,1,"How shall I tease our beloved captain next?",0
2627,107101,1,2,1,0,1,"Hmm? Do I detect the scent of blood? Perhaps a banquet is at hand!",0
2628,107101,1,3,1,0,1,"This monotonous peace will be the death of me.\nI need to cultivate a love for chaos.",0
2629,107101,1,4,1,0,1,"I hope I can have a real fight to the death with our captain someday!",0
2630,107101,1,5,1,0,1,"I need to teach that greenhorn knight what happens to people who call me ""old lady.""",0
2631,107101,1,101,4,0,1,"Until the day you touched my chest, I'd forgotten all about that geas...",0
2632,107101,1,102,8,0,1,"To think I, of all people, would make a proposal\nof marriage.\nWhat a hilarious farce.",0
2633,107101,2,1,1,0,1,"I just thought of a new way to amuse myself.\nAnd it involves you! ☆",0
2634,107101,2,2,1,0,1,"This tedium is killing me. Someone, give me a stimulating conversation!",0
2635,107101,2,3,1,0,1,"Are you bored, young lad? Then let's go and see what thrills we can find!",0
2636,107101,2,4,1,0,1,"What is it?\nDo you have some exciting news to report?",0
2637,107101,2,101,4,0,1,"How many men have sought my hand in marriage, you ask?\nI don't care to count.",0
2638,107101,2,102,8,0,1,"You'll be the groom of the world's mightiest woman! Isn't that something to be proud of?",0
2639,107101,2,1,1,1,1,"There's something in the air this morning... Something thrilling!",0
2640,107101,2,2,1,2,1,"Hmmm, I'm a little hungry. If only I could\neat my fill of chaos and excitement!",0
2641,107101,2,3,1,3,1,"This hour is for grown-up activities. Shall I teach you how to enjoy it properly?",0
2643,107101,3,2,1,0,1,"What am I thinking?\nCalm and relaxation are not my style at all...",0
2644,107101,3,3,1,0,1,"When I see sweet and adorable things, I can't help but imagine them being defiled.",0
2645,107101,3,4,1,0,1,"This scent is appealing... But personally, I prefer the smell of fresh blood! ☆",0
2646,107101,3,5,1,0,1,"Hah! You call this heat?\nIt can hardly compare to hell's inferno!",0
2648,107101,3,7,1,0,1,"This flavor is impressive. Almost as good as my own cooking!",0
2649,107101,3,8,1,0,1,"Ten ways to win a man's heart without fail?\nBah, ridiculous!",0
2651,105601,1,1,1,0,1,"Think I'll head to the usual fishing spot tomorrow. Might be worth inviting him, too.",0
2652,105601,1,2,1,0,1,"Woo! Nothing like knocking back a drink after some good exercise.",0
2653,105601,1,3,1,0,1,"Weather this good makes it hard to choose between fishing and taking a nap.",0
2654,105601,1,4,1,0,1,"There really is something special about fishing up a big catch.",0
2655,105601,1,5,1,0,1,"*yawn* Might be time for a nap.",0
2656,105601,1,101,4,0,1,"Hehe. He's got a lot more guts than you'd expect.",0
2657,105601,1,102,8,0,1,"I wonder what sort of fish'll help him grow up big and strong...",0
2658,105601,2,1,1,0,1,"It's all fun and games until you call me Boss Lady. Then you're in for it.",0
2659,105601,2,2,1,0,1,"The trick behind fishing? It's all about experience. How about we head out now?",0
2660,105601,2,3,1,0,1,"You need a hand with something? Then leave it to me.",0
2661,105601,2,4,1,0,1,"Lend me a hand if we come across someone in need of help again. I'm counting on you.",0
2662,105601,2,101,4,0,1,"Found yourself in a bit of trouble? Guess I'll have to leave that nap for later.",0
2663,105601,2,102,8,0,1,"Aww! You're such a good, kind kid! You deserve all the praise!",0
2664,105601,2,1,1,1,1,"Morning! A fishmonger's got to be up nice and early, you know.",0
2665,105601,2,2,1,2,1,"We got some fish in this morning, so how about you have some of it for lunch?",0
2666,105601,2,3,1,3,1,"The moon's just perfect for fishing tonight. I've got a good feeling about this.",0
2668,105601,3,2,1,0,1,"I wish I could sit on this and fish the day away.",0
2669,105601,3,3,1,0,1,"There, there... ♪ Oops. I should stop hugging anything cute the second I notice it.",0
2670,105601,3,4,1,0,1,"Working with fish makes cats approach me, but maybe this can help deal with the smell.",0
2671,105601,3,5,1,0,1,"Fishing in the winter's all well and good, but I wish it wasn't so cold.",0
2673,105601,3,7,1,0,1,"Can't fish on an empty stomach. Which means it's time to eat.",0
2674,105601,3,8,1,0,1,"Huh... Never knew there was a fish like this. Wouldn't mind catching it one of these days.",0
2676,101301,1,1,1,0,1,"I'd probably get yelled at\nif I fired off my magic indoors, huh...",0
2677,101301,1,2,1,0,1,"Holy moly, cute girls everywhere! Did I die\nand go to heaven?",0
2678,101301,1,3,1,0,1,"I should share my manga recs with everyone!\nCan't let the extra copies\nI bought go to waste!",0
2679,101301,1,4,1,0,1,"R-remember, Nanaka,\nthis isn't your own house, so have some restraint!",0
2680,101301,1,5,1,0,1,"Hey, look! 69,420 rupies!\n...Bah, no reaction.",0
2681,101301,1,101,4,0,1,"Hmm, which manga should I lend out next~?",0
2682,101301,1,102,8,0,1,"Next time we do our regular rounds, I'll take you somewhere special!",0
2683,101301,2,1,1,0,1,"I found a costume that'll suit you perfectly!\nYou'll be a real magical girl in no time!",0
2684,101301,2,2,1,0,1,"Aha! If you're free right now, why don't you come do the rounds with me?!",0
2685,101301,2,3,1,0,1,"Battles are great and all, but I want to learn magic that'll come in handy in everyday life, too!",0
2686,101301,2,4,1,0,1,"I just came up with\na brand-new spell!\nAm I a genius, or what?",0
2687,101301,2,101,4,0,1,"Everyone needs a cool catchphrase or two!\nI'll think one up for you!",0
2688,101301,2,102,8,0,1,"Am I becoming a normie?\nNo! It can't be! Nobody's a bigger otaku than me!",0
2689,101301,2,1,1,1,1,"Morning...\nI was up reading all night, so I'm still sleepy...",0
2690,101301,2,2,1,2,1,"Let's have lunch, and fuel our bodies up for this afternoon's rounds!",0
2691,101301,2,3,1,3,1,"When the sun goes down, an otaku's day is just getting started!",0
2693,101301,3,2,1,0,1,"Ahhhh! Lazing around\nand reading all day!\nThis is the life!",0
2694,101301,3,3,1,0,1,"You're such a cutie!\nLike a magical girl's\ntrusty mascot!",0
2695,101301,3,4,1,0,1,"I've been lured in by a luscious scent... Could\nthis be a cunning trap?!",0
2696,101301,3,5,1,0,1,"It's warm here, but maybe not the safest place for reading books...",0
2698,101301,3,7,1,0,1,"Delish! I need sauces on this one! Gimme deets!",0
2699,101301,3,8,1,0,1,"Is... is this in an ancient language?! Stick to the common tongue, kthxbye.",0
2701,190901,1,1,1,0,1,"Heehee! Time to think up a new prank to play! ♪",0
2702,190901,1,2,1,0,1,"I love seeing how people react when they breathe in the mist of Lake Illusion! ♪",0
2703,190901,1,3,1,0,1,"I still can't go outside, but it's nice just being able to move about freely. ♪",0
2704,190901,1,4,1,0,1,"This is a pretty nice room, all things considered. I can play all sorts of pranks in it, too. ♪",0
2705,190901,1,5,1,0,1,"Funny how this place went from being a dreaded tomb to somewhere I can feel relaxed. ♪",0
2706,190901,2,1,1,0,1,"Your head's real comfy, you know that? You can have the privilege of being my own personal seat. ♪",0
2707,190901,2,2,1,0,1,"Sure seems like trouble outside. But hey. I'm more than okay with doing my own thing. ♪",0
2708,190901,2,3,1,0,1,"Someone drew all over your face? Wow. No idea who it was, but they must love a good prank. ♪",0
2709,190901,2,4,1,0,1,"That Fio, I swear. Where's she off gallivanting now?",0
2710,190901,2,1,1,1,1,"Mornings sure are rough for you humans, huh? Don't worry. I'll chill out enough to make up for it. ♪",0
2711,190901,2,2,1,2,1,"Aww... I really, really wanna get out and take a nice walk in the sun!",0
2712,190901,2,3,1,3,1,"Whenever it gets this dark, I can't help but remember the time I was sealed away...",0
2714,190901,3,2,1,0,1,"All that pranking's got me exhausted. Time for a little break. ♪",0
2715,190901,3,3,1,0,1,"A proud guide fairy would never be entranced by something... this... absolutely adorable! ♪",0
2716,190901,3,4,1,0,1,"I could use this scent to lure everyone into a great prank. Now that's a plan! ♪",0
2717,190901,3,5,1,0,1,"Temperature difference doesn't mean anything to me, but I just can't drag myself away from this for some reason.",0
2719,190901,3,7,1,0,1,"My body doesn't need sustenance. Which means I can just eat whatever, whenever I want. ♪",0
2720,190901,3,8,1,0,1,"Oho? So these are the hot new pranks these days? I gotta try them out on him. ♪",0
2722,108401,1,1,1,0,1,"Happy holidays! I'll spread cheer through song!",0
2723,108401,1,2,1,0,1,"Our meeting wasn't by chance. I'm sure it was a holiday miracle.",0
2724,108401,1,3,1,0,1,"There's just something so marvelous about this festive season. It makes me feel like I'm a child again.",0
2725,108401,1,4,1,0,1,"The only reason I can feel confident writing a song is because you're by my side.",0
2726,108401,1,5,1,0,1,"You're here with me. That's all I need to write a song that will touch everyone's hearts.",0
2727,108401,1,101,4,0,1,"It'd be lovely if we could both experience the joys of this festive season together...",0
2728,108401,1,102,8,0,1,"I want to sing a song. A holiday song wishing for your happiness.",0
2729,108401,2,1,1,0,1,"I hold the smiles of those around me dear to my heart. And that is why I'll keep singing.",0
2730,108401,2,2,1,0,1,"I'd like to be a Santa of sorts. One that delivers songs of happiness to everyone.",0
2731,108401,2,3,1,0,1,"Are you free? How about we hold a holiday celebration together?",0
2732,108401,2,4,1,0,1,"I should do some vocal exercises before the concert. It can't hurt to be well prepared.",0
2733,108401,2,101,4,0,1,"I'm hardly the cutest of the bunch, but maybe this outfit can work its own charm?",0
2734,108401,2,102,8,0,1,"It's so much easier to channel my feelings for him into a song...",0
2735,108401,2,1,1,1,1,"If I could envelop the world in happiness through song, then I'd gladly do it every day.",0
2736,108401,2,2,1,2,1,"What say we enjoy some tea and talk about our favorite music?",0
2737,108401,2,3,1,3,1,"Hehe. Hoping for a little lullaby, maybe?",0
2739,108401,3,2,1,0,1,"This is so pleasingly comfortable. I might actually fall asleep.",0
2740,108401,3,3,1,0,1,"How lovely. It's so soothing, much like a gentle song.",0
2741,108401,3,4,1,0,1,"There's no doubt I can write a lovely song when I'm overflowing with this much inspiration.",0
2742,108401,3,5,1,0,1,"I want my songs to light the way ahead, just like this does.",0
2744,108401,3,7,1,0,1,"Eating well is an important part of keeping my throat nice and healthy.",0
2745,108401,3,8,1,0,1,"Stories share a similar creative process to songs, so there's plenty of hints to find while reading them.",0
2747,108401,3,14,1,0,1,"I never expected the drawings to pop out of the book. Is there a spirit residing within, perhaps?",0
2748,108401,3,15,1,0,1,"O-oh no, it's so adorable. Do you mind if I touch it? ♪",0
2749,108501,1,1,1,0,1,"Just because it's the holidays doesn't mean I can slack off on my rehearsals!",0
2750,108501,1,2,1,0,1,"Waugh... Getting everything ready for the holidays is taking forever...",0
2751,108501,1,3,1,0,1,"I need to make sure Ayane doesn't try to snatch some food without telling anyone.",0
2752,108501,1,4,1,0,1,"I wish I could act as jolly as the real Santa. But that's too much for me...",0
2753,108501,1,5,1,0,1,"These new clothes are so nice. I need to thank Suzume for them. ♪",0
2754,108501,1,101,4,0,1,"I need to get a nice present for him. ♪",0
2755,108501,1,102,8,0,1,"Ahh, the festive season. The season of love... Waugh?! Wh-what am I saying?!",0
2756,108501,2,1,1,0,1,"Happy holidays! ♪",0
2757,108501,2,2,1,0,1,"D-don't stare at me like that. It's embarrassing...",0
2758,108501,2,3,1,0,1,"Waugh?! Please don't touch me out of the blue. You scared me...",0
2759,108501,2,4,1,0,1,"Oh. Do you want to help me with the holiday preparations?",0
2760,108501,2,101,4,0,1,"I'm really looking forward to spending the holidays with you. ♪",0
2761,108501,2,102,8,0,1,"Do you, um, mind if we spend... Waugh. Never mind.",0
2762,108501,2,1,1,1,1,"Urgh... I was so excited about the party that I barely slept...",0
2763,108501,2,2,1,2,1,"I should have something light for lunch. Otherwise I won't have any room for cake.",0
2764,108501,2,3,1,3,1,"I'm a bit tired already, but I kind of want to stay up late tonight. ♪",0
2766,108501,3,2,1,0,1,"It's so fluffy... I've still got preparations to do, but I might end up falling asleep here.",0
2767,108501,3,3,1,0,1,"I'd love to play house with this. ♪",0
2768,108501,3,4,1,0,1,"What a nice smell... It'd be fun if we could all hold an aroma party together. ♪",0
2769,108501,3,5,1,0,1,"It's so comfy. I just want to stay here forever. ♪",0
2771,108501,3,7,1,0,1,"*munch* This might be even more delicious than traditional holiday meals. ♪",0
2772,108501,3,8,1,0,1,"Wow. I never knew there were this many holiday-themed plays...",0
2774,108501,3,14,1,0,1,"Wow! It's like I'm really watching a play! ♪",0
2775,108501,3,15,1,0,1,"How adorable! I'd love to use it as a practice partner for my acting. ♪",0
2776,108601,1,1,1,0,1,"Sweet, delicious cake! Huge, juicy turkey! And it's all mine! ♪",0
2777,108601,1,2,1,0,1,"I wish this holiday came around every day. ♪",0
2778,108601,1,3,1,0,1,"Presents? Check. Delicious food? Check. This holiday season really is the best. ♪",0
2779,108601,1,4,1,0,1,"And now for Pukichi to show us a special holiday trick! ""Don't put me on the spot like that!""",0
2780,108601,1,5,1,0,1,"Did you get fatter, Pukichi? You feel heavier than usual. ""Blame the outfit, not me!""",0
2781,108601,1,101,4,0,1,"This holiday's even more fun with you around. ♪",0
2782,108601,1,102,8,0,1,"I dunno why, but I get really flustered whenever I hug him.",0
2783,108601,2,1,1,0,1,"Happy holidays! Feel free to give any presents you've got to me. ♪",0
2784,108601,2,2,1,0,1,"Aren't these bear ears adorable? Now me and Pukichi have matching looks. ♪",0
2785,108601,2,3,1,0,1,"Y'know, I'd just love to eat a big, sweet cake right about now... ♪",0
2786,108601,2,4,1,0,1,"You'd be surprised at how snug Pukichi is in his holiday outfit! Feel free to give him a touch, if you want.",0
2787,108601,2,101,4,0,1,"Ehehe. Your hands are just so big and warm. It's great.",0
2788,108601,2,102,8,0,1,"I hope he spoils me again next year as well. ♪",0
2789,108601,2,1,1,1,1,"Huh? Where's my cake...? ""You're still half-asleep, kid.""",0
2790,108601,2,2,1,2,1,"I wanna a nice, big turkey for lunch. ♪ ""You'll have to wait until dinner.""",0
2791,108601,2,3,1,3,1,"It's time for sleep, kid. I wanna wait until Santa comes...",0
2793,108601,3,2,1,0,1,"Oh gosh, it's so soft and comfy! Pukichi! You've got real competition here!",0
2794,108601,3,3,1,0,1,"Oh wow! It's so cute! ""A rival appears!""",0
2795,108601,3,4,1,0,1,"What a nice smell... Oh! I should try moving this onto Pukichi... ""I'm no scent sachet, kid.""",0
2796,108601,3,5,1,0,1,"It's so nice and warm! Ehehe. I'll warm you up too, Pukichi.",0
2798,108601,3,7,1,0,1,"Pukichi! This is super delicious! ♪ ""Don't eat too much now, you hear?""",0
2799,108601,3,8,1,0,1,"O-of course I can read this. I'm a grown-up, after all... ""Don't push yourself, kiddo.""",0
2801,108601,3,14,1,0,1,"Pictures jumping out of a book, huh? I could pull some good pranks if I made that work with Pukichi. ♪",0
2802,108601,3,15,1,0,1,"I-It's really cute, yeah... But Santa Pukichi's even cuter! ♪",0
2803,108901,1,1,1,0,1,"Kimonos are surprisingly easy to move in once you get used to them.",0
2804,108901,1,2,1,0,1,"Oh, the strap on my sandal came loose. I guess training with these on wasn't a good idea.",0
2805,108901,1,3,1,0,1,"I'm feeling a bit peckish. I wonder if the mochi Yui made is still good to eat?",0
2806,108901,1,4,1,0,1,"I should take my current outfit into consideration if the need for battle arises.",0
2807,108901,1,5,1,0,1,"I can't help but worry about the state of Hiyori's kimono considering how much she moves around...",0
2808,108901,1,101,4,0,1,"I want to be with my friends forever. Him, too...",0
2809,108901,1,102,8,0,1,"I need to better myself even more if I want my wish granted!",0
2810,108901,2,1,1,0,1,"Oh, my hair accessory fell out of place? Thanks for adjusting it.",0
2811,108901,2,2,1,0,1,"Is it that unusual to see someone in a kimono? How about you try wearing one, then? Sorry. I was only joking.",0
2812,108901,2,3,1,0,1,"You like how the shawl feels? Feel free to touch it more, then.",0
2813,108901,2,4,1,0,1,"Oh, this katana? I got it from one of my fishing friends.",0
2814,108901,2,101,4,0,1,"Being with you always helps me settle down.",0
2815,108901,2,102,8,0,1,"You're something of a beacon to me. Always shining the way ahead.",0
2816,108901,2,1,1,1,1,"Good morning. Would you like to join me in my morning training?",0
2817,108901,2,2,1,2,1,"This is the perfect time to take a little break. It'll boost your efficiency a lot.",0
2818,108901,2,3,1,3,1,"Night's fallen already, huh? Then let's call it a day and prepare ourselves for another day of hard work.",0
2820,108901,3,2,1,0,1,"I almost fell asleep there for a second. Maybe I'm more tired than I thought.",0
2821,108901,3,3,1,0,1,"Hehe. A yukata would look lovely on this.",0
2822,108901,3,4,1,0,1,"Phew... Pleasant scents like this truly help you unwind after a busy day.",0
2823,108901,3,5,1,0,1,"It's so comfortable... I should take care not to fall asleep.",0
2825,108901,3,7,1,0,1,"Delicious as this is, I should quit while I'm ahead. I'd rather not let it take its toll on my body.",0
2826,108901,3,8,1,0,1,"Going for a stroll is nice and all, but sometimes it's nice to just stay inside and enjoy some reading.",0
2828,108801,1,1,1,0,1,"I wonder what sort of osechi dishes Mr. Knight likes?",0
2829,108801,1,2,1,0,1,"I've gotten pretty used to cleaning and doing laundry in my kimono. ♪",0
2830,108801,1,3,1,0,1,"Which kind of grab bag should I buy this year? ♪",0
2831,108801,1,4,1,0,1,"All sorts of seasonings can be used with mochi. Which means I've got plenty of preparing to do.",0
2832,108801,1,5,1,0,1,"My cheeks are all squishy like mochi now. I think I ate too much...",0
2833,108801,1,101,4,0,1,"I hope I can spend New Year's with everyone again. Ideally forever.",0
2834,108801,1,102,8,0,1,"Please. I just want him to know how I feel...",0
2835,108801,2,1,1,0,1,"My hair accessory looks like it's going to fall off? Do you mind fixing it for me, then?",0
2836,108801,2,2,1,0,1,"You want to wear a kimono as well? Then... how about we go buy one together?",0
2837,108801,2,3,1,0,1,"Oh, Mr. Knight. How much mochi do you want in your soup?",0
2838,108801,2,4,1,0,1,"It's pretty cold outside, isn't it? Here. This porridge'll warm you right up.",0
2839,108801,2,101,4,0,1,"I hope Mr. Knight and I can... Huh?! Mr. Knight?! J-just ignore me!",0
2840,108801,2,102,8,0,1,"I want to be the one to grant Mr. Knight's wish...",0
2841,108801,2,1,1,1,1,"Good morning. You'll wake right up if you take in some sunlight.",0
2842,108801,2,2,1,2,1,"I should get lunch ready. Would you like some as well?",0
2843,108801,2,3,1,3,1,"Today just flew right by, didn't it? I might end up saying the same about this year as a whole.",0
2845,108801,3,2,1,0,1,"Phew... I should loosen my sash a little bit.",0
2846,108801,3,3,1,0,1,"I kind of want to knit a kimono for it.",0
2847,108801,3,4,1,0,1,"If only this worked as a skin moisturizer as well.",0
2848,108801,3,5,1,0,1,"Mmm... It's too comfy. I don't wanna go anywhere now...",0
2850,108801,3,7,1,0,1,"If I could hibernate like a bear, I'd gobble this right up.",0
2851,108801,3,8,1,0,1,"This is the ideal time of the year to confess my feelings... B-but I just can't bring myself to do it!",0
2853,108701,1,1,1,0,1,"Everyone seems so busy... Don't worry! Hiyori's here to save the day!",0
2854,108701,1,2,1,0,1,"Hm... Should I help Yui or Rei? Actually, why not both!",0
2855,108701,1,3,1,0,1,"Oh no! My kimono's all messed up! I can't tie the sash myself!",0
2856,108701,1,4,1,0,1,"The first shrine visit of the year's always so fun! I should plan out a route for all the food stalls.",0
2857,108701,1,5,1,0,1,"It's New Year's! Let's make the most of it!",0
2858,108701,1,101,4,0,1,"Hm... I wonder what Mr. Knight's New Year's plans are?",0
2859,108701,1,102,8,0,1,"Urgh... Looking at Mr. Knight makes my heart skip a beat...",0
2860,108701,2,1,1,0,1,"There's a tasty smell coming from me? *sniff* Oh. It's the smell of sauce!",0
2861,108701,2,2,1,0,1,"Where'd my hairpin go... Oh, you picked it up for me? Thanks!",0
2862,108701,2,3,1,0,1,"You think my hairpin's cute? You want to touch it? Just be gentle, then.",0
2863,108701,2,4,1,0,1,"Eating with these gloves on must be hard? Don't worry! I've practiced enough that I can even use chopsticks with them!",0
2864,108701,2,101,4,0,1,"Huh? My cheeks are all red? Nah, you're just imagining it!",0
2865,108701,2,102,8,0,1,"Being with you is just so... Never mind! It's still a secret!",0
2866,108701,2,1,1,1,1,"Good morning! Here's to another happy, fulfilling day!",0
2867,108701,2,2,1,2,1,"Hey, are you hungry? 'Cause I sure am! Let's get something to eat together!",0
2868,108701,2,3,1,3,1,"Another day of hard work! Huh? I'm always working hard? Really?",0
2870,108701,3,2,1,0,1,"Time for a break! A little bit of rest, and I'll be back in action! ♪",0
2871,108701,3,3,1,0,1,"It's so cute! ♪ But I'm scared I'll end up breaking it...",0
2872,108701,3,4,1,0,1,"Ahh... What a nice scent. I'm all refreshed now!  ♪",0
2873,108701,3,5,1,0,1,"It's so warm and cozy. I just wanna curl up into a little ball now...",0
2875,108701,3,7,1,0,1,"Th-this is bad! I just can't stop myself!",0
2876,108701,3,8,1,0,1,"Huh. People used to get mochi instead of New Year's pocket money? I'm glad they changed that.",0
2878,109001,1,1,1,0,1,"Now waft the delicious scent of chocolate...\nThere. Everything's ready.",0
2879,109001,1,2,1,0,1,"I'll fill this place to the brim with my chocolate...",0
2880,109001,1,3,1,0,1,"Waiting for him while wearing this apron...\nI look almost like... Teeheehee.",0
2881,109001,1,4,1,0,1,"Hm, where's the kitchen? I'd like to cook up a little something...",0
2882,109001,1,5,1,0,1,"I'll make sure he can't live without my chocolates...\nTeehee. I'm only joking...",0
2883,109001,1,101,4,0,1,"This chocolate tastes like destiny... One bite, and you'll never leave my side. That too is fate...",0
2884,109001,1,102,8,0,1,"This isn't like me at all...\nI think my heart actually skipped a beat...",0
2885,109001,2,1,1,0,1,"Tell me, my love.\nThere isn't anything you're hiding from me,\nis there...?",0
2886,109001,2,2,1,0,1,"I made these chocolates\nall by myself...\nI'm quite confident in how they turned out.",0
2887,109001,2,3,1,0,1,"If you taste any bitter notes, it's just the richness of the chocolate. Think nothing of it...",0
2888,109001,2,4,1,0,1,"Now, where did I put that antidote...?",0
2889,109001,2,101,4,0,1,"You and I are bound together by fate...\nJust any old chocolate\nwill not do at all.",0
2890,109001,2,102,8,0,1,"Once you finish the chocolate, it's time for the main dish... Go ahead and eat me right up.",0
2891,109001,2,1,1,1,1,"Here's your morning chocolate to wake you right up. You may not be able to sleep for a while...",0
